{
  "protocolVersion": "1.3.0",
  "sessionId": "5d81618b-b713-4d67-8e81-b9096671b8b7",
  "trialId": "SCORED-01",
  "commandId": "9b0ae565-96bb-442f-b026-0b245893e189",
  "stateVersion": 7,
  "sender": "DASHBOARD",
  "target": "SERVER",
  "timestampUtc": "2026-07-20T00:03:05.000Z",
  "timestampMonotonicMs": 186000,
  "type": "SUBMIT",
  "payload": {
    "attemptNumber": 1,
    "verbalSubmissionObserved": true,
    "runtimeDecision": "INCORRECT"
  }
}
